{
  "schemaVersion": "pack-2-draft-1",
  "assignmentId": "assign:ops-leadership-example",
  "assigneeId": "person:example",
  "assignmentKind": "role",
  "roleId": "role:operations-leadership",
  "scope": {
    "scopeType": "organisation",
    "scopeId": "org:fika",
    "scopeLabel": "FIKA"
  },
  "status": "active",
  "source": "Approved role assignment fixture",
  "approvedBy": "person:derek",
  "authorityGrantIds": [
    "grant:manage-role-catalogue"
  ],
  "effectivePeriod": {
    "startAt": "2026-07-14T00:00:00Z",
    "endAt": null,
    "reason": "Draft fixture effective period"
  },
  "provenance": {
    "sourceBdrIds": [
      "ROLE-002",
      "ROLE-004"
    ],
    "sourceSnapshot": "02 Pack 2-20260714T164540Z-1-001.zip",
    "authorityRank": "Approved GRR"
  },
  "audit": {
    "version": 1,
    "createdAt": "2026-07-14T12:00:00Z",
    "createdBy": "role:platform-governance",
    "updatedAt": "2026-07-14T12:00:00Z",
    "updatedBy": "role:platform-governance",
    "events": [
      {
        "eventType": "drafted",
        "occurredAt": "2026-07-14T12:00:00Z",
        "actorId": "role:platform-governance",
        "reason": "Pack 2 schema draft fixture"
      }
    ]
  }
}
